"7304.59","Tubes, pipes and hollow profiles, seamless, of circular cross-section, of alloy steel other than stainless, not cold-drawn or cold-rolled ""cold-reduced"" "
"7304.90","Tubes, pipes and hollow profiles, seamless, of non-circular cross-section, of iron or steel "
"7305.11","Line pipe of a kind used for oil or gas pipelines, having circular cross-sections and an external diameter of > 406,4 mm, of iron or steel, longitudinally submerged arc welded"
"7305.12","Line pipe of a kind used for oil or gas pipelines, having circular cross-sections and an external diameter of > 406,4 mm, of iron or steel, longitudinally arc welded "
"7305.19","Line pipe of a kind used for oil or gas pipelines, having circular cross-sections and an external diameter of > 406,4 mm, of flat-rolled products of iron or steel "
"7305.20","Casing of a kind used in drilling for oil or gas, having circular cross-sections and an external diameter of > 406,4 mm, of flat-rolled products of iron or steel"
"7305.31","Tubes and pipes having circular cross-sections and an external diameter of > 406,4 mm, of iron or steel, longitudinally welded "
"7305.39","Tubes and pipes having circular cross-sections and an external diameter of > 406,4 mm, of iron or steel, welded "
"7305.90","Tubes and pipes having circular cross-sections and an external diameter of > 406,4 mm, of flat-rolled products of iron or steel, welded "
"7306.11","Line pipe of a kind used for oil or gas pipelines, welded, of flat-rolled products of stainless steel, of an external diameter of <= 406,4 mm"
"7306.19","Line pipe of a kind used for oil or gas pipelines, welded, of flat-rolled products of iron or steel, of an external diameter of <= 406,4 mm "
"7306.21","Casing and tubing of a kind used in drilling for oil or gas, welded, of flat-rolled products of stainless steel, of an external diameter of <= 406,4 mm"
"7306.29","Casing and tubing of a kind used in drilling for oil or gas, welded, of flat-rolled products of iron or steel, of an external diameter of <= 406,4 mm "
"7306.30","Tubes, pipes and hollow profiles, welded, of circular cross-section, of iron or non-alloy steel "
"7306.40","Tubes, pipes and hollow profiles, welded, of circular cross-section, of stainless steel "
"7306.50","Tubes, pipes and hollow profiles, welded, of circular cross-section, of alloy steel other than stainless "
"7306.61","Tubes and pipes and hollow profiles, welded, of square or rectangular cross-section, of iron or steel"
"7306.69","Tubes, pipes and hollow profiles, welded, of non-circular cross-section, of iron or steel "
"7306.90","Tubes, pipes and hollow profiles ""e.g., open seam, riveted or similarly closed"", of iron or steel "
"7307.11","Tube or pipe fittings of non-malleable cast iron"
"7307.19","Cast tube or pipe fittings of iron or steel "
"7307.21","Flanges of stainless steel "
"7307.22","Threaded elbows, bends and sleeves of stainless steel "
"7307.23","Butt welding tube or pipe fittings of stainless steel "
"7307.29","Tube or pipe fittings of stainless steel "
"7307.91","Flanges of iron or steel "
"7307.92","Threaded elbows, bends and sleeves, of stainless steel "
"7307.93","Butt welding fittings of iron or steel "
"7307.99","Tube or pipe fittings, of iron or steel "
"7308.10","Bridges and bridge-sections, of iron or steel"
"7308.20","Towers and lattice masts, of iron or steel"
"7308.30","Doors, windows and their frames and thresholds for doors, of iron or steel"
"7308.40","Equipment for scaffolding, shuttering, propping or pit-propping "
"7308.90","Structures and parts of structures, of iron or steel, n.e.s. "
"7309.00","Reservoirs, tanks, vats and similar containers, of iron or steel, for any material ""other than compressed or liquefied gas"", of a capacity of > 300 l, not fitted with mechanical or thermal equipment, whether or not lined or heat-insulated "
"7310.10","Tanks, casks, drums, cans, boxes and similar containers, of iron or steel, for any material, of a capacity of >= 50 l but <= 300 l, n.e.s. "
"7310.21","Cans of iron or steel, of a capacity of < 50 l, which are to be closed by soldering or crimping "
"7310.29","Tanks, casks, drums, cans, boxes and similar containers, of iron or steel, for any material, of a capacity of < 50 l, n.e.s. "
"7311.00","Containers of iron or steel, for compressed or liquefied gas "
"7312.10","Stranded wire, ropes and cables, of iron or steel "
"7312.90","Plaited bands, slings and the like, of iron or steel "
"7313.00","Barbed wire of iron or steel; twisted hoop or single flat wire, barbed or not, and loosely twisted double wire, of a kind used for fencing, of iron or steel"
"7314.12","Endless bands of stainless steel wire, for machinery"
"7314.14","Woven cloth, incl. endless bands, of stainless steel wire "
"7314.19","Woven cloth, incl. endless bands, of iron or steel wire "
"7314.20","Grill, netting and fencing, welded at the intersection, having a mesh size of >= 100 cm, of iron or steel wire with a maximum cross-sectional dimension of >= 3 mm"
"7314.31","Grill, netting and fencing, of iron or steel wire, welded at the intersection, plated or coated with zinc "
"7314.39","Grill, netting and fencing, of iron or steel wire, welded at the intersection "
"7314.41","Grill, netting and fencing, of iron or steel wire, not welded at the intersection, plated or coated with zinc"
"7314.42","Grill, netting and fencing, of iron or steel wire, not welded at the intersection, coated with plastics"
"7314.49","Grill, netting and fencing, of iron or steel wire, not welded at the intersection "
"7314.50","Expanded metal, of iron or steel"
"7315.11","Roller chain of iron or steel"
"7315.12","Articulated link chain of iron or steel "
"7315.19","Parts of articulated link chain, of iron or steel"
"7315.20","Skid chain for motor vehicles, of iron or steel"
"7315.81","Stud-link of iron or steel"
"7315.82","Welded link chain of iron or steel "
"7315.89","Chain of iron or steel "
"7315.90","Parts of skid chain, stud-link chain and other chains of heading 7315 "
"7316.00","Anchors, grapnels and parts thereof, of iron or steel"
"7317.00","Nails, tacks, drawing pins, corrugated nails, staples and similar articles of iron or steel, whether or not with heads of other material "
"7318.11","Coach screws of iron or steel"
"7318.12","Wood screws of iron or steel "
"7318.13","Screw hooks and screw rings, of iron or steel"
"7318.14","Self-tapping screws, of iron or steel "
"7318.15","Threaded screws and bolts, of iron or steel, whether or not with their nuts and washers "
"7318.16","Nuts of iron or steel"
"7318.19","Threaded articles, of iron or steel, n.e.s."
"7318.21","Spring washers and other lock washers, of iron or steel"
"7318.22","Washers of iron or steel "
"7318.23","Rivets of iron or steel "
"7318.24","Cotters and cotter pins, of iron or steel"
"7318.29","Non-threaded articles, of iron or steel"
"7319.40","Safety pins and other pins of iron or steel, n.e.s."
"7319.90","Knitting needles, bodkins, crochet hooks, embroidery stilettos and similar articles, for use in the hand, of iron or steel"
"7320.10","Leaf-springs and leaves therefor, of iron or steel "
"7320.20","Helical springs, of iron or steel "
"7320.90","Springs and leaves for springs, of iron or steel, incl. flat spiral springs "
"7321.11","Appliances for baking, frying, grilling and cooking and plate warmers, for domestic use, of iron or steel, for gas fuel or for both gas and other fuels "
"7321.12","Appliances for baking, frying, grilling and cooking and plate warmers, for domestic use, of iron or steel, for liquid fuel "
"7321.19","Appliances for baking, frying, grilling and cooking and plate warmers, for domestic use, of iron or steel, for solid fuel or other non-electric source of energy "
"7321.81","Stoves, heaters, grates, fires, wash boilers, braziers and similar appliances, of iron or steel, for gas fuel or for both gas and other fuels "
"7321.82","Stoves, heaters, grates, fires, wash boilers, braziers and similar appliances, of iron or steel, for liquid fuel "
"7321.89","Stoves, heaters, grates, fires, wash boilers, braziers and similar domestic appliances, of iron or steel, for solid fuel or other non-electricsource of energy "
"7321.90","Parts of domestic appliances non-electrically heated of heading 7321, n.e.s."
"7322.11","Radiators for central heating, non-electrically heated, and parts thereof, of iron or steel "
"7322.19","Radiators for central heating, non-electrically heated, and parts thereof, of iron other than cast iron or steel "
"7322.90","Air heaters and hot-air distributors, incl. distributors which can also distribute fresh or conditioned air, non-electrically heated, incorporating a motor-driven fan or blower, and parts thereof, of iron or steel"
"7323.10","Iron or steel wool; pot scourers and scouring or polishing pads, gloves and the like, of iron or steel"
"7323.91","Table, kitchen or other household articles, and parts thereof, of cast iron, not enamelled "
"7323.92","Table, kitchen or other household articles, and parts thereof, of cast iron, enamelled "
"7323.93","Table, kitchen or other household articles, and parts thereof, of stainless steel "
"7323.94","Table, kitchen or other household articles, and parts thereof, of iron other than cast iron or steel other than stainless, enamelled "
"7323.99","Table, kitchen or other household articles, and parts thereof, of iron other than cast iron or steel other than stainless "
"7324.10","Sinks and washbasins, of stainless steel"
"7324.21","Baths of cast iron, whether or not enamelled"
"7324.29","Baths of steel sheet"
"7324.90","Sanitary ware, incl. parts thereof "
"7325.10","Articles of non-malleable cast iron, n.e.s."
"7325.91","Grinding balls and similar articles for mills, cast "
"7325.99","Cast articles of iron or steel, n.e.s. "
"7326.11","Grinding balls and similar articles for mills, of iron or steel, forged or stamped, but not further worked"
"7326.19","Articles of iron or steel, forged or stamped, but not further worked, n.e.s. "
"7326.20","Articles of iron or steel wire, n.e.s."
"7326.90","Articles of iron or steel, n.e.s. "
"7401.00","Copper mattes; cement copper ""precipitated copper"""
"7402.00","Copper, unrefined; copper anodes for electrolytic refining"
"7403.11","Copper, refined, in the form of cathodes and sections of cathodes"
"7403.12","Copper, refined, in the form of wire-bars"
"7403.13","Copper, refined, in the form of billets"
"7403.19","Copper, refined, unwrought "
"7403.21","Copper-zinc base alloys ""brass"" unwrought"
"7403.22","Copper-tin base alloys ""bronze"" unwrought"
"7403.29","Copper alloys unwrought "
"7404.00","Waste and scrap, of copper "
"7405.00","Master alloys of copper "
"7406.10","Copper powders, of non-lamellar structure "
"7406.20","Copper powders, of lamellar structure, and flakes of copper "
"7407.10","Bars, rods and profiles, of refined copper, n.e.s."
"7407.21","Bars, rods and profiles, of copper-zinc base alloys ""brass"", n.e.s."
"7407.29","Bars, rods and profiles of copper alloys, n.e.s. "
"7408.11","Wire of refined copper, with a maximum cross-sectional dimension of > 6 mm"
"7408.19","Wire of refined copper, with a maximum cross-sectional dimension of <= 6 mm"
"7408.21","Wire of copper-zinc base alloys ""brass"""
"7408.22","Wire of copper-nickel alloys ""cupro-nickel"" or copper-nickel-zinc alloys ""nickel silver"""
"7408.29","Wire of copper alloys (other than copper-zinc alloys [brass], copper-nickel alloys [cupro-nickel] or copper-nickel-zinc alloys [nickel silver])"
"7409.11","Plates, sheets and strip, of refined copper, in coils, of a thickness of > 0,15 mm "
"7409.19","Plates, sheets and strip, of refined copper, not in coils, of a thickness of > 0,15 mm "
"7409.21","Plates, sheets and strip, of copper-zinc base alloys ""brass"", of a thickness of > 0,15 mm, in coils "
"7409.29","Plates, sheets and strip, of copper-zinc base alloys ""brass"", of a thickness of > 0,15 mm, not in coils "
"7409.31","Plates, sheets and strip, of copper-tin base alloys ""bronze"", of a thickness of > 0,15 mm, in coils "
"7409.39","Plates, sheets and strip, of copper-tin base alloys ""bronze"", of a thickness of > 0,15 mm, not in coils "
"7409.40","Plates, sheets and strip, of copper-nickel base alloys ""cupro-nickel"" or copper-nickel-zinc base alloys ""nickel silver"", of a thickness of > 0,15 mm, not in coils "
"7409.90","Plates, sheets and strip, of copper alloys, of a thickness of > 0,15 mm "
"7410.11","Refined copper foil, not backed, of a thickness of <= 0,15 mm "
"7410.12","Copper alloy foil, not backed, of a thickness of <= 0,15 mm "
"7410.21","Refined copper foil, backed, of a thickness ""excl. any backing"" of <= 0,15 mm "
"7410.22","Copper alloy foil, backed, of a thickness ""excl. any backing"" of <= 0,15 mm "
"7411.10","Tubes and pipes of refined copper"
"7411.21","Tubes and pipes of copper-zinc base alloys ""brass"""
"7411.22","Tubes and pipes of copper-nickel base alloys ""cupro-nickel"" or copper-nickel-zinc base alloys ""nickel silver"""
"7411.29","Tubes and pipes of copper alloys "
"7412.10","Refined copper tube or pipe fittings ""e.g., couplings, elbows, sleeves"""
"7412.20","Copper alloy tube or pipe fittings ""e.g., couplings, elbows, sleeves"""
"7413.00","Stranded wire, cables, plaited bands and the like, of copper "
"7415.10","Nails, tacks, drawing pins, staples and similar articles, of copper or with shafts of iron or steel and heads of copper "
"7415.21","Washers, ""incl. spring washers and spring lock washers"", of copper"
"7415.29","Rivets, cotters, cotter pins and the like, not threaded, of copper "
"7415.33","Screws, bolts, nuts and similar articles, threaded, of copper (other than screw hooks, ring- and eyebolts, lag screws, plugs, bungs and the like, with screw thread)"
"7415.39","Screw hooks, screw rings and the like, threaded, of copper "
"7418.10","Table, kitchen or other household articles and parts thereof, and pot scourers and scouring or polishing pads, gloves and the like, of copper "
"7418.20","Sanitary ware and parts thereof, of copper "
"7419.10","Chain and parts thereof, of copper "
"7419.91","Articles of copper, cast, moulded, stamped or forged, but not further worked, n.e.s."
"7419.99","Articles of copper, n.e.s."
"7501.10","Nickel mattes"
"7501.20","Nickel oxide sinters and other intermediate products of nickel metallurgy "
"7502.10","Nickel, not alloyed, unwrought"
"7502.20","Unwrought nickel alloys"
"7503.00","Waste and scrap, of nickel "
"7504.00","Powders and flakes, of nickel "
"7505.11","Bars, rods, profiles and wire, of non-alloy nickel, n.e.s. "
"7505.12","Bars, rods, profiles and wire, of nickel alloys, n.e.s. "
"7505.21","Wire of non-alloy nickel "
"7505.22","Wire of nickel alloys "
"7506.10","Plates, sheets, strip and foil, of non-alloy nickel "
"7506.20","Plates, sheets, strip and foil, of nickel alloys "
"7507.11","Tubes and pipes of non-alloy nickel"
"7507.12","Tubes and pipes of nickel alloys"
"7507.20","Tube or pipe fittings, of nickel"
"7508.10","Cloth, grill, netting and fencing, of nickel wire"
"7508.90","Articles of nickel, n.e.s."
"7601.10","Aluminium, not alloyed, unwrought"
"7601.20","Unwrought aluminium alloys"
"7602.00","Waste and scrap, of aluminium "
"7603.10","Powders of aluminium, of non-lamellar structure "
"7603.20","Powders of aluminium, of lamellar structure, and flakes of aluminium "
"7604.10","Bars, rods and profiles, of non-alloy aluminium, n.e.s."
"7604.21","Hollow profiles of aluminium alloys, n.e.s."
"7604.29","Bars, rods and solid profiles, of aluminium alloys, n.e.s."
"7605.11","Wire of non-alloy aluminium, with a maximum cross-sectional dimension of > 7 mm "
"7605.19","Wire of non-alloy aluminium, with a maximum cross-sectional dimension of <= 7 mm (other than stranded wires, cables, ropes and other articles of heading 7614, electrically insulated wires, strings for musical instruments)"
"7605.21","Wire of aluminium alloys, with a maximum cross-sectional dimension of > 7 mm "
"7605.29","Wire, of aluminium alloys, having a maximum cross-sectional dimension of <= 7 mm (other than stranded wires, cables, ropes and other articles of heading 7614, electrically insulated wires, strings for musical instruments)"
"7606.11","Plates, sheets and strip, of non-alloy aluminium, of a thickness of > 0,2 mm, square or rectangular "
"7606.12","Plates, sheets and strip, of aluminium alloys, of a thickness of > 0,2 mm, square or rectangular "
"7606.91","Plates, sheets and strip, of non-alloy aluminium, of a thickness of > 0,2 mm (other than square or rectangular)"
"7606.92","Plates, sheets and strip, of aluminium alloys, of a thickness of > 0,2 mm (other than square or rectangular)"
"7607.11","Aluminium foil, not backed, rolled but not further worked, of a thickness of <= 0,2 mm "
"7607.19","Aluminium foil, not backed, rolled and further worked, of a thickness of <= 2 mm "
"7607.20","Aluminium foil, backed, of a thickness "
"7608.10","Tubes and pipes of non-alloy aluminium "
"7608.20","Tubes and pipes of aluminium alloys "
"7609.00","Aluminium tube or pipe fittings ""e.g., couplings, elbows, sleeves"""
"7610.10","Doors, windows and their frames and thresholds for door, of aluminium "
"7610.90","Structures and parts of structures, of aluminium, n.e.s., and plates, rods, profiles, tubes and the like, prepared for use in structures, of aluminium, n.e.s. "
"7611.00","Reservoirs, tanks, vats and similar containers, of aluminium, for any material (other than compressed or liquefied gas), of a capacity of > 300 l, not fitted with mechanical or thermal equipment, whether or not lined or heat-insulated "
"7612.10","Collapsible tubular containers, of aluminium"
"7612.90","Casks, drums, cans, boxes and similar containers, incl. rigid tubular containers, of aluminium, for any material (other than compressed or liquefied gas), of a capacity of <= 300 l, n.e.s."
"7613.00","Aluminium containers for compressed or liquefied gas"
"7614.10","Stranded wire, cables, plaited bands and the like, of aluminium, with steel core "
"7614.90","Stranded wires, cables, ropes and similar articles, of aluminium (other than with steel core and electrically insulated products)"
"7615.10","Table, kitchen or other household articles and parts thereof, and pot scourers and scouring or polishing pads, gloves and the like, of aluminium "
"7615.20","Sanitary ware and parts thereof, of aluminium "
"7616.10","Nails, tacks, staples, screws, bolts, nuts, screw hooks, rivets, cotters, cotter pins, washers and similar articles, of aluminium "
"7616.91","Cloth, grill, netting and fencing, of aluminium wire "
"7616.99","Articles of aluminium, n.e.s."
"7801.10","Unwrought lead, refined"
"7801.91","Unwrought lead, containing by weight antimony as the principal other element"
"7801.99","Unwrought lead "
"7802.00","Lead waste and scrap "
"7804.11","Lead sheets, strip and foil, of a thickness ""excl. any backing"" of <= 0,2 mm"
"7804.19","Lead plates; lead sheets, strip and foil, of a thickness ""excl. any backing"" of > 0,2 mm"
"7804.20","Lead powders and flakes "
"7806.00","Articles of lead, n.e.s."
"7901.11","Unwrought zinc, not alloyed, containing by weight >= 99,99% of zinc"
"7901.12","Unwrought zinc, not alloyed, containing by weight < 99,99% of zinc"
"7901.20","Unwrought zinc alloys"
"7902.00","Zinc waste and scrap "
"7903.10","Zinc dust"
"7903.90","Zinc powders and flakes "
"7904.00","Zinc bars, rods, profiles and wire, n.e.s."
"7905.00","Zinc plates, sheets, strip and foil"
"7907.00","Articles of zinc, n.e.s."
"8001.10","Unwrought tin, not alloyed"
"8001.20","Unwrought tin alloys"
"8002.00","Tin waste and scrap "
"8003.00","Tin bars, rods, profiles and wire, n.e.s."
"8007.00","Articles of tin, n.e.s."
"8101.10","Tungsten powders"
"8101.94","Unwrought tungsten, incl. bars and rods of tungsten obtained simply by sintering"
"8101.96","Tungsten wire"
"8101.97","Tungsten waste and scrap "
"8101.99","Articles of tungsten, n.e.s."
"8102.10","Molybdenum powders"
"8102.94","Unwrought molybdenum, incl. bars and rods obtained simply by sintering"
"8102.95","Molybdenum bars and rods (other than those obtained simply by sintering), profiles, plates, sheets, strip and foil, n.e.s."
"8102.96","Molybdenum wire"
"8102.97","Molybdenum waste and scrap "
"8102.99","Articles of molybdenum, n.e.s."
"8103.20","Unwrought tantalum, incl. bars and rods of tantalum obtained simply by sintering; tantalum powders"
"8103.30","Tantalum waste and scrap "
"8103.90","Articles of tantalum, n.e.s."
"8104.11","Unwrought magnesium, containing >= 99,8% by weight of magnesium"
"8104.19","Unwrought magnesium, containing < 99,8% by weight of magnesium"
"8104.20","Magnesium waste and scrap "
"8104.30","Magnesium raspings, turnings and granules, graded according to size; magnesium powders"
"8104.90","Articles of magnesium, n.e.s."
"8105.20","Cobalt mattes and other intermediate products of cobalt metallurgy; unwrought cobalt; cobalt powders"
"8105.30","Cobalt waste and scrap "
"8105.90","Articles of cobalt, n.e.s."
"8106.00","Bismuth and articles thereof, n.e.s.; bismuth waste and scrap "
"8107.20","Unwrought cadmium; cadmium powders"
"8107.30","Cadmium waste and scrap "
"8107.90","Articles of cadmium, n.e.s."
"8108.20","Unwrought titanium; titanium powders"
"8108.30","Titanium waste and scrap "
"8108.90","Articles of titanium, n.e.s."
"8109.20","Unwrought zirconium; zirconium powders"
"8109.30","Zirconium waste and scrap "
"8109.90","Articles of zirconium, n.e.s."
"8110.10","Unwrought antimony; antimony powders"
"8110.20","Antimony waste and scrap "
"8110.90","Articles of antimony, n.e.s."
"8111.00","Manganese and articles thereof, n.e.s.; manganese waste and scrap "
"8112.12","Unwrought beryllium; beryllium powders"
"8112.13","Beryllium waste and scrap "
"8112.19","Articles of beryllium, n.e.s."
"8112.21","Unwrought chromium; chromium powders"
"8112.22","Chromium waste and scrap "
"8112.29","Articles of chromium, n.e.s."
"8112.51","Unwrought thallium; thallium powders"
"8112.52","Thallium waste and scrap "
"8112.59","Articles of thallium, n.e.s."
"8112.92","Unwrought hafnium ""celtium"", niobium ""columbium"", rhenium, gallium, indium, vanadium and germanium; powders and waste and scrap of these metals "
"8112.99","Articles of hafnium ""celtium"", niobium ""columbium"", rhenium, gallium, indium, vanadium and germanium, n.e.s."
"8113.00","Cermets and articles thereof, n.e.s.; waste and scrap of cermets "
"8201.10","Spades and shovels, with working parts of base metal"
"8201.30","Mattocks, picks, hoes and rakes, with working parts of base metal "
"8201.40","Axes, billhooks and similar hewing tools, with working parts of base metal "
"8201.50","Secateurs and similar one-handed pruners and shears, incl. poultry shears, with working parts of base metal"
"8201.60","Hedge shears, two-handed pruning shears and similar two-handed shears, with working parts of base metal"
"8201.90","Scythes, sickles, hay knives, timber wedges and other hand tools of a kind used in agriculture, horticulture or forestry, with working parts of base metal "
"8202.10","Handsaws, with working parts of base metal "
"8202.20","Bandsaw blades of base metal"
"8202.31","Circular saw blades, incl. slitting or slotting saw blades, of base metal, with working parts of steel"
"8202.39","Circular saw blades, incl. slitting or slotting saw blades, and parts thereof, of base metal, with working parts of materials other than steel"
"8202.40","Chainsaw blades of base metal"
"8202.91","Straight saw blades, of base metal, for working metal"
"8202.99","Saw blades, incl. toothless saw blades, of base metal "
"8203.10","Files, rasps and similar hand tools of base metal"
"8203.20","Pliers, incl. cutting pliers, pincers and tweezers for non-medical use and similar hand tools, of base metal"
"8203.30","Metal-cutting shears and similar hand tools, of base metal"
"8203.40","Pipe-cutters, bolt croppers, perforating punches and similar hand tools, of base metal"
"8204.11","Hand-operated spanners and wrenches, incl. torque meter wrenches, of base metal, non-adjustable"
"8204.12","Hand-operated spanners and wrenches, incl. torque meter wrenches, of base metal, adjustable "
"8204.20","Interchangeable spanner sockets, with or without handles, of base metal"
"8205.10","Hand-operated drilling, threading or tapping hand tools"
"8205.20","Hammers and sledge hammers with working parts of base metal"
"8205.30","Planes, chisels, gouges and similar cutting tools for working wood"
"8205.40","Hand-operated screwdrivers"
"8205.51","Household hand tools, non-mechanical, with working parts of base metal, n.e.s."
"8205.59","Hand tools, incl. glaziers' diamonds, of base metal, n.e.s."
"8205.60","Blowlamps and the like "
"8205.70","Vices, clamps and the like "
"8205.90","Anvils; portable forges; hand- or pedal-operated grinding wheels with frameworks; sets of articles of two or more subheadings of heading 8205"
"8206.00","Sets of two or more tools of heading 8202 to 8205, put up in sets for retail sale"
"8207.13","Rock-drilling or earth-boring tools, interchangeable, with working parts of sintered metal carbides or cermets"
"8207.19","Rock-drilling or earth-boring tools, interchangeable, and parts therefor, with working parts of materials other than sintered metal carbide or cermets"
"8207.20","Interchangeable dies for drawing or extruding metal"
"8207.30","Interchangeable tools for pressing, stamping or punching"
"8207.40","Tools for tapping or threading, interchangeable"
"8207.50","Tools for drilling, interchangeable "
"8207.60","Interchangeable tools for boring or broaching"
"8207.70","Interchangeable tools for milling"
"8207.80","Interchangeable tools for turning"
"8207.90","Interchangeable tools for hand tools, whether or not power-operated, or for machine tools, n.e.s."
"8208.10","Knives and cutting blades, of base metal, for machines or for mechanical appliances, for metalworking"
